{"assets":[{"path":"assets/expedition-banner.png","sha256":"f46136573154bd392efb09ed4c648276fe3d74ea3357fd4bdab5fbf236761747","size":79},{"path":"assets/expedition-march.png","sha256":"4f2f7d91c240c2a7c1fd0a09fa4126adfa6ca291aefaef9cd67e675e64d0e0ab","size":79}],"page_model":{"path":"runtime-model.toml","sha256":"48436c84ae1ca29f41063cab625428bd6520e7a6db5fc6a4577fcdbea75ae789","size":1727},"runtime_artifact_format":1,"runtime_model_format":4}