{"assets":[{"path":"assets/fixture-anchor.png","sha256":"41c1f4a7d209d34f49d2454769c415e298414f015a2595f3486dc8ba61e21865","size":70},{"path":"assets/fixture-mark.png","sha256":"b1c7b2d0e30f2d3b314b8f726cdc2ce1c7c331fea94fc60b111b10574b7c63ab","size":70}],"page_model":{"path":"runtime-model.toml","sha256":"b402e193a36e64f8917ff9d6c1f8066aa4c18a11c2d76389868172a79fcd9254","size":1252},"runtime_artifact_format":1,"runtime_model_format":4}